테슬라키팝  꽁돈생기는정보,게시판,생각의 힘으로 거,2023. 9. 21. 17:08,"     테슬라키팝은 현재 전기 자동차 산업에서 가장 혁신적인 기업 중 하나로 알려져 있습니다그들의 혁신적인 기술과 창의적인 마케팅 전략으로 인해 테슬라키팝은 꽁돈을 창출하는 정보를 제공하고 있습니다테슬라키팝이 꽁돈을 생기는 주요 원인 중 하나는 그들의 제품에 대한 수요입니다전기 자동차 시장은 계속해서 성장하고 있으며, 테슬라키팝은 이 시장에서 주도적인 위치를 차지하고 있습니다그들의 고급 승용차와 인기 있는 모델 3은 소비자들 사이에서 매우 인기가 높으며, 이로 인해 많은 수익을 창출하고 있습니다또한, 테슬라키팝은 자체 배터리 기술과 태양광 에너지 저장 시스템 등 다양한 영역에서 혁신을 이루어내고 있습니다이러한 혁신적인 기술과 제품들이 다른 기업들에 비해 경쟁 우위를 가져오며, 테슬라키팝에게 꽁돈을 생기는 정보를 제공하고 있습니다테슬라키팝의 꽁돈생기는 정보를 알아보면, 우리는 그들의 혁신적인 접근 방식과 지속적인 성장 가능성에 대해 더욱 확신할 수 있습니다이는 테슬라키팝이 미래에도 계속해서 꽁돈을 창출할 것으로 기대되는 이유 중 하나입니다                ",https://blog.naver.com/91f70g4d/223217893331
볼보 디젤차 생산 중단 선언! 전기차로 간다,국 외 차,PREC,2023. 9. 21. 17:06,"                ​​안녕하세요 프렉입니다!​​                    ​​20일 업계 그리고 외신에 따르면볼보는 전기차 기업으로 대 전환을 위해2024년부터 디젤 엔진 장착 내연기관차 생산을완전히 중단한다고 밝혔습니다!                    이는 볼보의 전기차 시장 선점을 위한발빠른 행보로 풀이됩니다.​​                    ​         고객의 모든 요구를 충족시키는프리미엄급 순수 전기차 포트폴리오를만드는데 주력하고 있다.디젤 엔진을 사용하는 내연기관차 생산은2024년 초 종료된다.앞으로 몇 달 후 마지막 디젤카가 생산될 것이며볼보는 이 같은 단계를 밟는 최초의 전통완성차 업체가 될 것이다.업계와 정치 지도자들이 기후 변화에맞춰 의미 있는 정책과 행동을 해야 할 때,볼보는 볼보의 역할을 다하는데 전념하겠다. 볼보 최고 경영자 짐 로완(CEO) 성명서         ​볼보의 주력 차종이 디젤 차였던 것을감안하면 이번 선언은 정말 파격적인 일입니다.올해 8월 기준으로 볼보 신차 판매량 67%가가솔린과 디젤 등 내연기관차이며나머지 33%는 하이브리드 또는플러그인하이브리드를 포함한 전기 차입니다.​​                               ​​볼보는 2040년까지 생산과 판매에서완전한 탄소 중립을 이룬다는 목표 아래2030년부터 매년 2개의 전기차 모델을출시할 계획으로 전해졌습니다.순수 전기차 기업으로 도약하기 위해스웨덴 배터리 제조사 노스 볼트(Northvolt)와 협력하여2025년까지 예태보리에 배터리 셀 공장을 설립,유럽 완성차 브랜드 가운데 최초미국에서 테슬라 전기차 충전시설 <슈퍼차저>를사용하기로 하는 등전기차 전환에 박차를 가하고 있습니다!​​                               ​​한국에서도 전동화 전환 속도를 높일 방침이며짐 로완 CEO는 지난 3월 방한하여올해 말 순수 전기 플래그십 SUV EX9을올해 말 국내에 공개하겠다고 밝혔습니다.​                    ​EX90에는 중국의 CALT와 LG에너지솔루션의배터리가 탑재될 예정입니다.​​                                    ​EX90은 1회 충전으로 최대 600km까지주행할 수 있는 7인승 전기차 SUV입니다.라이더에 플러스로센서 16개/레이더 5개/카메라 8개가 탑재안전성을 강화하여 사고율 19% 낮추는 등의특징을 가지고 있습니다.​볼보는 지난해 국내 시장에서 1000대의 전기차를판매했는데, 올해는 8월 기준으로435대의 전기차를 판매하여 7위를 기록,하이브리드(9579대)와 플러그인하이브리드(938대)까지 포함할 경우 판매량은 총 1만 517대입니다.​볼보의 파격적인 선언과 앞으로의 행보.정말 기대됩니다!​                    ​읽어주셔서 감사합니다.​​     ",https://blog.naver.com/yatajok_molly/223217892104
강남허리디스크 의심될 때 씨티? 엠알아이검사?,척추 MRI 검사,그린몰의원,2023. 9. 21. 17:05,"     안녕하세요. 당일 MRI 검사 및 결과 확인 가능한 그린몰의원 입니다.​                    ​저희 그린몰 MRI 센터에서는 모든 환자분들이 빠르게 진료받아 볼 수 있도록 최선을 다하고 있습니다. 일반 대학/종합병원의 경우 최소 7일 이상 기다려야 MRI 검사 확인이 가능하지만 본원에서는 내원부터 최종 결과 확인까지 3시간 정도가 소요되고 있습니다.​                    ​현재 빠르게 결과를 받아 보셔야 하는 상태이거나, 이상 증상이 심하게 동반되어 중증 질환 여부 체크가 필요한 분들은 상기 내용 참조하셔서 도움받아 보시기 바랍니다.​오늘 저희가 포스팅 통해 따로 안내 드릴 내용은 척추질환을 의심하고 있는 분들에게 CT가 아닌 왜 MRI 검사를 추천드리는지 말씀드리려 합니다. 현재 아래와 같은 증상이 반복되거나 수개월에 걸쳐 지속되고 있는 상태라면 3분만 해당 글을 꼼꼼히 읽어봐 주시기 바랍니다. ​□ 팔, 다리 힘이 빠지는 듯한 느낌이 난다□ 물리치료를 받았지만 통증이 호전되지 않는다□ 원인을 알 수 없는 통증이 반복되고 있다□ 걷다가 주저 않는 때가 많아졌다□ 팔, 다리 부근 저린 증상이 지속된다​                    ​         척추 MRI 꼭 찍어야 될까요?         ​위 체크리스트, 한번 확인해 보셨나요? ​만약 1개 이상이라도 해당이 되신다면 여러분은 척추질환 MRI 검사 대상자입니다. 이렇게 말씀을 드리면 많은 분들께서 ""꼭 MRI 찍어야 되나요?""라고 질문해 주시곤 하는데요. 아무래도 의학적 지식이 부족할 수밖에 없어 CT와 MRI 검사가 같은 것이라고 생각하는 분들이 많이 계십니다.​인체 내부를 촬영한다는 점에선 같겠지만 두 가지 검사는 엄연히 다른 특징을 가지고 있기 때문에 유의해 주는 것이 좋은데요. 그렇다면 척추질환을 확인하기 위해선 왜 MRI 검사가 병행되어야만 될까요? 그 해답을 말씀드리도록 하겠습니다. ​                    ​더 정확한 결과를 위해MRI 검사받아 보셔야 합니다​척추질환의 경우 초기 원인을 알 수 없는 통증이 동반된다는 특징이 있죠. 통증이 느껴지면 우리는 MRI보다는 조금 더 익숙한 CT부터 먼저 찍어 보게 됩니다. 그런데 여기서 ""아무 이상 없습니다.""라는 소견을 받았지만 이상 증상이 계속되는 경우들이 있을 텐데요.​그 이유는 MRI 검사를 해야 확인 가능한 질환이 있고, CT를 통해서는 확인되지 않는 질환이 있기 때문입니다. 그중 대표적인 것이 디스크/협착증/척추 종양 등이 있는데요.​CT의 경우 전산화 단층 촬영 기법이 들어가기 때문에 골절이나 디스크 상태를 확인하기는 좋지만 신경의 눌림 정도나 디스크 퇴행의 정도, 뼈 내부 조직 상태 등을 확인할 수는 없어 사실상 디스크/협착증/척추 종양 등을 정확히 확인하기가 어렵습니다. 그렇기 때문에 앞으로 올바른 치료 계획을 빠르게 수립해 나가기 위해선 척추질환 MRI 검사부터 받아 현재 상태를 면밀히 확인해 보는 것이 중요하다고 말할 수 있는데요.​                    ​각 질환에 알맞은 검사가 진행되어야만 합니다​저희 그린몰의원은 척추질환 진료에 능숙한 재활의학과 전문의가 상주해 있어 MRI 검사 전 X-ray 촬영/초음파/근전도 검사 등을 통해 현재 상태를 면밀히 점검합니다. 만약 이상 소견이 나왔다면 그때부터 MRI 검사가 시행돼 이상 증상의 원인을 좀 더 명확하게 확인해 나가게 되는데요. ​                    ​본원에서 진행하고 있는 MRI 검사의 경우 대학, 종합병원에서 사용하는 독일 지멘스 마그네톰 비다 3테슬라(3T)로 진료받아 보실 수 있으며 30% 더 합리적인 비용으로 진단받아 볼 수 있습니다.​                    ​또한 획기적으로 줄어든 소음으로 평소 폐소공포증을 앓고 계신 환자분들도 쾌적하게 검사받아 보실 수 있는데요. 이외에도 중증 질환 소견 시 본원과 연계돼 있는 대학, 종합병원에서 빠른 치료도 받아 볼 수 있으니 ""원인을 알지 못하는 통증이 반복되고 있어요."", ""허리가 계속 콕콕 쑤시는 듯한 느낌이 나요."" 등의 고민이 있으시다면 신사역 7번 출구 바로 앞 위치, 그린몰의원을 찾아 주시기 바랍니다. ​                  그린몰의원 카카오톡 문의 ▽​              그린몰의원 5개 분야별 전문의 진료 멀티클리닉, MRI 센터&건강검진센터 운영 bit.ly            ​하단 [전화 연결] 버튼 클릭 ▽​           그린몰의원 서울특별시 강남구 도산대로 107 7층           ​그린몰의원 위치 확인 ▽​             그린몰의원 서울특별시 강남구 도산대로 107 7층                  ",https://blog.naver.com/drshinyoung/223217890362
"[09월 21일 장마감정리] 중입자 치료, 위메이드, 바이오 (상한가 종목 : 셀바스헬스케어, 위메이드플레이, 신신제약, 위메이드맥스, 모비스, 우정바이오)",BUL's 토픽,불릿,2023. 9. 21. 17:01,"     불릿 사이트에 올라온 2023년 9월 20일자 장마감 토픽입니다더 많은 무료 정보는 아래 링크에서 받아보시기 바랍니다불릿 : https://bulit.io/텔레그램 : https://t.me/official_bulit                    오늘의 한줄 시황 코스피(KOSPI) 2,514.97 ▼44.77 (-1.75%)코스닥(KOSDAQ) 860.68 ▼22.04 (-2.50%)환율(USD/KRW) 1,339.70 ▲9.60 (+0.72%)코스피, 1.7%대 급락…주식·채권·원화 '트리플 약세'외인·기관 팔자 속 낙폭 키우는 증시…코스피 2510선으로 '뚝'길어지는 긴축 우려에 투자 심리 얼어붙어""고금리 더 오래 간다""…""내년에도 금리인하 없다"" 韓증시 부담​09/21(목)상승률 TOP20 *스팩, 우선주 제외 1. 셀바스헬스케어 (30%) AI 심장 초음파 솔루션 사업을 공동으로 추진 중인 미국 '울트라사이트'와 합작 법인 설립 발표 영향, 체성분분석기 및 전자동혈압계 등 의료진단기기 생산 사업 영위 2. 위메이드플레이 (29.99%) 위메이드의  중국 '성취게임즈'의 한국 자회사 '액토즈소프트'로부터 1,000억 원 규모 IP 사업 수권 계약 소식, 대표작 '애니팡', '아쿠아스토리' 등 게임 개발 기업 3. 신신제약 (29.98%) 마이크로니들 연구시설 구축 마무리에 세계 최초 마이크로니들 의약품인 '국소 관절염 치료제' 개발 본격화 기대감, 파스류 등의 OTC 의약품 제조 사업 영위 4. 위메이드맥스 (29.96%) 위메이드의  중국 '성취게임즈'의 한국 자회사 '액토즈소프트'로부터 1,000억 원 규모 IP 사업 수권 계약 소식, 대표작 '실크로드', '미르4' 등 개임 및 소프트웨어 개발 사업 영위 5. 모비스 (29.89%) 19일 국내에서 처음으로 중입자 치료를 받은 전립선암 환자의 긍정적 치료 소식에 중입자 치료 관련주 부각, 과거 가속기용 정밀 RF제어시스템 국산화 성공 이력 부각 6. 우정바이오 (29.86%) 19일 국내에서 처음으로 중입자 치료를 받은 전립선암 환자의 긍정적 치료 소식에 중입자 치료 관련주 부각, 과거 방사광가속기를 활용한 협력 계약 체결 부각 7. 비츠로테크 (24.36%) 19일 국내에서 처음으로 중입자 치료를 받은 전립선암 환자의 긍정적 치료 소식에 중입자 치료 관련주 부각, 방사광가속기 내 가속관 및 에너지 배가장치 공급 이력 부각 8. 넥스틸 (18.81%) 특별한 이슈 X, 송유관 및 배관 등 강관 생산 사업 영위, 2023년 신규 상장주 9. 다원시스 (18.57%) 19일 국내에서 처음으로 중입자 치료를 받은 전립선암 환자의 긍정적 치료 소식에 중입자 치료 관련주 부각, 자회사 '다원메닥스'의 과거 암치료 관련 붕소중성자포획치료 국책사업 참여 이력 부각 10. 원풍물산 (15.72%) 당사가 투자한 미국 '렐마다 테라퓨틱스'가 개발한 우울증 신약후보 물질의 임상 3상에서 유의미한 결과 소식, 남성복 정장 및 캐쥬얼 판매 사업 영위 11. 액토즈소프트 (14.27%) 위메이드와 라이선스 해결 후 1,000억 원 규모 계약을 통한 중국 내 사업 확장 기대감, 대표작 '미르2', '미르3' 등 모바일 게임 개발 사업 영위 12. 엠아이큐브솔루션 (14.21%) 두산로보틱스 청약 관심에 '두산'과 협동로봇 협력사 관계 부각, AI 기반 플랫폼 및 소프트웨어 개발 사업 영위, 2023년 신규 상장주 13. 서남 (14.1%) 19일 국내에서 처음으로 중입자 치료를 받은 전립선암 환자의 긍정적 치료 소식에 중입자 치료 관련주 강세로 핵융합 관련주 확산, 핵융합과 플라즈마 연구사실 부각 14. 만호제강 (13.69%) 최대주주와 2대주주의 경영권 분쟁 영향, 와이어로프 및 섬유로프 생산 사업 영위 15. 씨씨에스 (13.13%) 특별한 이슈 X, 충청북도 지역 케이블 TV 사업 영위 16. LB인베스트먼트 (12.61%) 유통물량의 16.5% 수준인 30억 원 규모 자사주 매입 계획, 2023년 신규 상장주 17. 지엘팜텍 (12.21%) 한미약품 대표가 설립한 '더블유사이언스'의 당사 경영권 인수 추진 소식, 개량신약 및 제네릭 등 의약품 제조 사업 영위 18. 위메이드 (11.77%) 중국 '성취게임즈'의 한국 자회사 '액토즈소프트'로부터 1,000억 원 규모 IP 사업 수권 계약 소식, 온라인 게임 및 소프트웨어 개발 사업 영위 19. 엑세스바이오 (11.31%) 1,179억 원 규모 코로나 진단키트 공급 계약 소식, 진단키트 등 체외진단 사업 영위 국내 상장 미국 기업 20. 미스터블루 (10.69%) 위메이드의  중국 '성취게임즈'의 한국 자회사 '액토즈소프트'로부터 1,000억 원 규모 IP 사업 수권 계약 소식에 과거 '미르의 전설' 웹툰 출시 이력 연관 붉은색 : 상한가 / 노란색 : 이틀 연속 상승 상위권 / 파란글씨 : 투자경고종목, 투자주의종목, 투자위험종목, 관리종목, 특별한 이슈X◆ 불릿 사이트에서 더 많은 콘텐츠 보기 ◆https://bit.ly/40eFgYI              불릿 | BUL s 시황 슈퍼개미 배진한식 기업분석 보고서, 데일리 시황정리, 매매 타점을 알려주는 신호 등 다양한 투자정보를 제공합니다. bit.ly              주간 업종 & 테마  8월 21일  8월 22일  8월 23일  8월 24일  8월 25일  금주 랭킹  맥신CCTV미용기기육계  오염수초전도체클라우드  양자컴퓨터정치인육계  AI오염수바이오  오염수신규 상장  1. 맥신2. 양자컴퓨터3. 오염수  8월 28일  8월 29일  8월 30일  8월 31일  9월 1일  금주 랭킹  원전양자암호민영화(방송)오염수  정부정책(보안,교육,저출산)AI조선  자율주행2차전지비만치료AI  로봇AI미용의료기기AI의료  반도체자율주행네옴시티  1. 정부정책2. 반도체3. 자율주행  9월 4일  9월 5일  9월 6일  9월 7일  9월 8일  금주 랭킹  로봇비만치료제자율주행철강&화학  AI의료자율주행(카메라모듈)정치인로봇  비만치료제AI의료정치인로봇  로봇반도체미중갈등원유  미중갈등(비료, 철강)AI의료로봇  1. AI의료2. 비만치료제3. 로봇  9월 11일  9월 12일  9월 13일  9월 14일  9월 15일  금주 랭킹  로봇AI바이오화장품  자율주행(테슬라)다이캐스팅바이오원유  5G비료네옴시티바이오연료  초전도체OLED바이오진단키트  네옴시티철강보안5G  1. 자율주행2. 로봇3. 네옴시티  9월 18일  9월 19일  9월 20일  9월 21일  9월 22일  금주 랭킹  5G(스타링크)네옴시티정치인  5G원전재건&네옴시티  양자암호미중갈등(광물)자동차5G  중입자 치료위메이드바이오  　  1. 5G2. 원전3. 중입자 치료  금일 강세 테마& 업종​중입자 치료 : 모비스, 우정바이오, 비츠로테크, 다원시스, 서남, 삼지전자, 스맥, 뷰노, 인피니트헬스케어위메이드 : 위메이드플레이, 위메이드맥스, 액토즈소프트, 위메이드, 미스터블루바이오 : 신신제약, 원풍물산, 지엘팜텍, 케이엠, 동성제약, 비씨월드제약, 위더스제약, 박셀바이오, HLB, HLB글로벌, 알테오젠, 유한양행, 대화제약진단키트 : 엑세스바이오, 에스디바이오센서, 휴마시스, 씨젠, 수젠텍, 엑세스바이오, 피씨엘, 지노믹트리, 진매트릭스, EDGC, 앤디포스, 나노엔텍, 녹십자엠에스, 대웅제약, 동아에스티, 디엔에이링크, 랩지노믹스, 마이크로디지탈, 마크로젠, 미코바이오메드, 바디텍메드, 바이오노트, 바이오니아, 서린바이오, 소마젠, 오상자이엘, 유바이오로직스, 인트론바이오, 제놀루션, 젠큐릭스, 진시스템, 퀀타매트릭스, 클리노믹스, 팜젠사이언스두산 로봇 : 엠아이큐브솔루션, 두산, 에스피시스템스보험 : 에이플러스에셋, 코리안리, 미래에셋생명, 한화생명, 삼성생명, 동양생명, 삼성화재, 한화손해보험, 롯데손해보험, 현대해상, DB손해보험, 흥국화재교육 : 유엔젤, NE능률, 비상교육, 아이비김영, 유비온, 대교, YBM넷, 메가엠디, 웅진씽크빅, 메가스터디, 아이스크림에듀, 골드앤에스, 멀티캠퍼스, 캐리소프트, 삼성출판사, 디지털대성            ★상한가 종목★ : 셀바스헬스케어, 위메이드플레이, 신신제약, 위메이드맥스, 모비스, 우정바이오​1. 중입자 치료(모비스, 우정바이오, 비츠로테크, 다원시스, 서남)중입자 치료 한 달 만에… 전립선암 60代 암 덩어리 모두 소멸https://www.chosun.com/national/welfare-medical/2023/09/20/OLOXWPN765HRTLAU2LXPUWVF54/?utm_source=naver&utm_medium=referral&utm_campaign=naver-news “암 세포 한달만에 사라져”…‘꿈의 치료법’에 급등한 종목은https://www.mk.co.kr/news/stock/10834528 2. 위메이드(위메이드플레이, 위메이드맥스, 엑토즈소프트, 위메이드, 미스터블루)위메이드, 中 ‘미르’ 라이선스 계약금 수령 소식에 강세https://www.mk.co.kr/news/stock/10834743 위메이드 '미르의 전설2·3' 라이선스 계약금 수령에…미스터블루 주가 '들썩'https://www.thekpm.com/news/articleView.html?idxno=174354 3. 바이오(신신제약, 원풍물산, 지엘팜텍, 엑세스바이오)신신제약 ""세계 최초 차세대 마이크로니들 의약품 개발 추진""https://www.newspim.com/news/view/20230921000335 [e외신] '원풍물산 투자사' 렐마다, '美 FDA 인정' 우울증 신약 3상서 개선 효과 '탁월'http://www.newsprime.co.kr/news/article/?no=613771 '동분서주' 삼성바이오로직스, 연간 수주 3조 돌파 총력https://www.moneys.co.kr/news/mwView.php?no=2023092108424357578 당일 외국인/기관 매매현황코스피            코스닥            ◆ 불릿 사이트에서 더 많은 콘텐츠 보기 ◆https://bit.ly/40eFgYI              불릿 | BUL s 시황 슈퍼개미 배진한식 기업분석 보고서, 데일리 시황정리, 매매 타점을 알려주는 신호 등 다양한 투자정보를 제공합니다. bit.ly            중입자 치료 : 모비스, 우정바이오, 비츠로테크, 다원시스, 서남, 삼지전자, 스맥, 뷰노, 인피니트헬스케어 위메이드 : 위메이드플레이, 위메이드맥스, 액토즈소프트, 위메이드, 미스터블루 바이오 : 신신제약, 원풍물산, 지엘팜텍, 케이엠, 동성제약, 비씨월드제약, 위더스제약, 박셀바이오, HLB, HLB글로벌, 알테오젠, 유한양행, 대화제약 진단키트 : 엑세스바이오, 에스디바이오센서, 휴마시스, 씨젠, 수젠텍, 엑세스바이오, 피씨엘, 지노믹트리, 진매트릭스, EDGC, 앤디포스, 나노엔텍, 녹십자엠에스, 대웅제약, 동아에스티, 디엔에이링크, 랩지노믹스, 마이크로디지탈, 마크로젠, 미코바이오메드, 바디텍메드, 바이오노트, 바이오니아, 서린바이오, 소마젠, 오상자이엘, 유바이오로직스, 인트론바이오, 제놀루션, 젠큐릭스, 진시스템, 퀀타매트릭스, 클리노믹스, 팜젠사이언스 두산 로봇 : 엠아이큐브솔루션, 두산, 에스피시스템스 보험 : 에이플러스에셋, 코리안리, 미래에셋생명, 한화생명, 삼성생명, 동양생명, 삼성화재, 한화손해보험, 롯데손해보험, 현대해상, DB손해보험, 흥국화재 교육 : 유엔젤, NE능률, 비상교육, 아이비김영, 유비온, 대교, YBM넷, 메가엠디, 웅진씽크빅, 메가스터디, 아이스크림에듀, 골드앤에스, 멀티캠퍼스, 캐리소프트, 삼성출판사, 디지털대성     ",https://blog.naver.com/bulit_io/223217886836
자동차세 개편에 대한 아쉬움(ft.테슬라 10만원??),경제,joomin84,2023. 9. 21. 16:58,"                기사가 자극적이다.나는 모델3 를 장기렌트로 타고 있다.렌트료에 포함되어서 개인적인 부담은 없지만기사제목만 보면 세금이 불합리한것처럼 느껴진다.​어떤책을 읽었는데세금의 시작 역시 부자들에게만 걷겠다고해서서민(?)들의 동의를 구해서 시작되었다고 한다.그런데,정부입장에서 돈을 걷어서 사용하다보니재미있다. 돈이 더 필요하다.점점 내려오다보니 서민들까지도 세금을 납부하게되었다고 한다.진짜인지 가짜인지는 모르겠지만...​자동차세...배기량이 기준이 된것도 웃기지만배기량이 높은차량이 아무래도 비싸다보니""비싼차 타는 부자에게 세금 많이 받고저렴한차 타는 서민에게는 조금만 받을께""라고해서 분명 시작되었을것이다.예전에는 자동차 있는것이 엄청난 부자이니깐.​그러나,지금은 자동차가 거의 필수아닌가?예전처럼 소수의 부자만 타는것인가?일반 서민들도 필수품이다.그렇지만,돈맛을 본 이상, 이것을 줄여나갈수없다.​사실 부자들은 합리적으로 다 빠져나간다.법인을 운영하면, 비용처리도 되고,세금도 쓸거먼저 쓰고 남는거에서 내고...​기사를 쓸때는 자극적으로 써야하니뭐라 할말은 없지만전기차 세금 올려도 부자들에게는영향이별로 없다.​지난번 블로그남겼는데연봉 1억이 넘어가면 38.5%의 소득세가 붙는다.10년전 대기업 연봉이 3~4천일때 연봉 1억이면, 고소득자가 맞고, 세금을 많이 낼 수 있다고 하지만지금은 주변에 연봉 1억받는 대기업분들 많이 늘어났다.​이들이 10년전처럼 고소득자인가?​고령화가 되면서 갈수록 나랏돈이 많이 필요하다.지금은 아반떼가 22만원인데 테슬라는 10만원이말이되나?라고 해서 테슬라타는 사람에게세금을 더 걷을께하고 있지만몇년이 지나 세금이 더 필요하면아반떼 타는데 22만원이 맞나, 다른사람들은경차타기도어려운데 라는 프레임으로아반떼 세금이 100만원이 되는날도곧 올것이다.​내가 아반떼를 타는데테슬라타는 놈들 세금 올라서 기분좋다가 아닌,지금의 정책이 맞는지를 고민해보자.​     ",https://blog.naver.com/joomin84/223217883216
"몰빵하지 마세요. 멘탈 관리 안 됩니다.(테슬라, 엔비디아, TQQQ)",오늘본 유튜브 ~,갈매,2023. 9. 21. 16:57,     https://youtu.be/1ii6MQcYKsE?si=Ifg7HO_-zKgfUFuV                 ​     ,https://blog.naver.com/proac2s/223217882200
