울프레디 테슬라 모델3&Y 전용방향제 후기,Third party,BellnSoo,2023. 9. 21. 18:44,"     우리가 생각을 안해봤던건지 모르겠지만테슬라에 맞게 나오는 방향제들이 참 많았다!​멋지게 생긴 방향제 광고가 나올때마다우리 테슬라는 해당사항이 없다라고만 생각해왔는데!!​                           오늘 소개할 울프레디 방향제도은은한 멋진 방향제라고 할수 있다!!​                    ​패키지부터 깔끔 심플한데!우리는 로즈색상에 Roseastra향을 주문!                    ​향과 색상은 각각 5가지씩 있는데색상은 블랙, 그레이, 로즈, 레드, 블루                                                Previous image Next image           ​향은 Emerald Dew, Bloom Bash, Moonlit Whisper, Sunkissed Bliss, Roseastra고급스러운 5가지 향 중에서 선택이 가능하다!​뭔가 테슬라들은 AI, 심플, 없음의 미학(?)이다보니모던한 테슬라 인테리어에은은한 로즈색상에 Roseastra 향이 어울릴 것 같아 선택했다!​                    패키지를 열면 향 블럭과 거치대가 나오는데거치대는 알루미늄 CNC가공이 되어있어서 깔끔하고 고급스럽게 보이는데​                           ​클립과 본체가 일체형으로 설계되어 있어서쉽고 안정적이게 설치가 가능하다!​                                      ​먼저 거치대를 분리해서 향을 넣어준다!향 모양도 다이아몬드 모양으로 파져있어서모양에 맞춰 넣으면 되는데!​                           ​상당히 큰 크기의 리필제가 들어있어서발향기간도 오래갈 것 같다! ​                    ​방향제 거치대는 다이아몬드 부분을 누를 수 있는데눌러서 송풍구 사이에 넣어서 고정하는 형태!​                    ​이 때 고정을 잘 시키기위해서 울프레디라고 적힌밀림방지 고무가 있는 것!!​                    ​밀림방지고무를 붙이고 안에 넣어주면딱 고정하게 되는데​                           ​은은하니 포인트가 되는 색상이다보니아주 좋은 선택이었던 것 같다!​                    ​반대로 고정하명 반대 문양으로도 활용가능!​테슬라 방향제로도 인테리어 아이템으로도제격인 울프레디 테슬라 전용 방향제!추천해본다!​🔻🔻울프레디 공식 구매링크🔻🔻              OLFREDY 올프레디 OLFREDY /테슬라 전용 프리미엄 방향제. olfredy.com            ​#울프레디 #테슬라방향제 #테슬라전용방향제 #테슬라악세사리​                    ​     ",https://blog.naver.com/bell_soo/223217981480
"테슬라 수퍼컴 도조, ARM, 손정의, 배터리, 탄소중립, SK이노베이션, 폐플라스틱, 열분해유, 현대제철, GS칼텍스, 바이오 항공유, 블루수소, 그린수소, 양수발전사업",간략메모(조선일보 한국경제),몽자,2023. 9. 21. 18:42,"     테슬라 수퍼컴 도조는 일본 유도 가라테에서 도장을 의미한다. 일론 머스크는 일본 문화 광팬이다. 테슬라는 자율주행 AI를 엔디비아 GPU 그래픽 처리장치를 사용했는데, 비싼 가격과 전력효율이 나쁘고 엔디비아에 쏠린 공급망 우려로 반도체 칩을 자체 설계한 후 대만 TSMC에서 생산했다. ​ARM 반도체 기본 설계도 만드는 회사, 전력소모가 작은 제품 설계, 스마트폰 등장은 ARM에게 큰 호재. ARM의  스마트폰 AP 설계시장 점유율은 99%, 매년 3조씩 수익중, 손정의가 2016년 42조에 지분100%인수, 2023년 9월 14일 나스닥 상장했다 ​K배터리 중국 배터리에 밀리는 중이다. 테슬라 벤츠 등 완성차들이 중국배터리를  선택한다. 비용절감과 중국시장 공략하기 위해서다.  기아와 포드도 중국 BYD 배터리를 사용했다.   세계1위 CATL은 테슬라등 많은 고객사를 확보했다. ​탄소중립을 위해 원자력, 재생에너지, 수소등 골고루 발전시켜야 한다. 정유산업은 항공 석유화학에서는 석유를 대체 할 수 없으므로 탄소 중립 기술 발전시켜야 한다. CSS(탄소 포집, 저장)을 활용해 저탄소 정유사업을 해야한다.​SK이노베이션은 폐플라스틱을 이용해서 재활용 플라스틱을 만든다. SK에너지는 대형 수소 화물차 충전소를 만들었다.  기존의 데이타 서버는 공기로 냉각시켰다.  SK엔무브는 냉각유에 데이타 서버를 침전시켜 냉각시킨다. SK인천석유화학은 폐타이어를 분해해 열분해유를 생성한다.​현대제철은 적은 전기를 사용하여 고철을 녹혀  고품질 강판을 세계 최초로 생산했다.에쓰오일은 수소생산 유통 판매를 계획하고 있다.​GS칼텍스는 폐플라스틱을 재활용해 열분해유를 생산할 계획이다. 동물성 유지 폐식용유로 만드는 바이오 항공유도 연구중이다. SK E&S는 생산과정에서 이산화탄소를 제거한 블루수소를 생산할 예정이고, 물의 전기분해로 얻는 그린수소도 준비하고 있다.​한국동서발전은 상부와 하부에 저수지를 만들고 연결된 관을 통해 물이 오가면서 발전과 양수가 되는 양수발전사업을 시작한다.​한국전력공사는 수퍼커팩시터와 리튬 배터리를 혼합한 하이브리드형 에너지 저장 장치인 ESS를 개발추진중이다.  리튬배터리의  화재 위험과 수명이  짧은  단점을 개선한 제품이다.​ LG에너지솔루션은 QR코드를 통해 원재료 채굴부터 재활용 정보까지를 수록하는 배터리 전자 여권 개발에 참여한다.포스코인터네셔널은 탄소 포집 저장하는 CSS사업을 추진하고 있다.​​​​​     ",https://blog.naver.com/dreamer1004-/223217980089
2024토레스EVX KG모빌리티 쌍용전기차 성능 제원 가격 알아보기,기타자동차,윤윤이,2023. 9. 21. 18:37,"      안녕하세요! 윤윤이입니다. 오늘은 KG모빌리티(구 쌍용자동차)에서 드디어 토레스전기차가 출시 되었습니다. 티볼리 E-MOTION 이후로 나름 출시가 기대되는 SUV 전기차 중 하나였는데요. 가격은 3천만원대에 100만km 보증을 해준다고 할 정도로 자신감에 차있는 모습입니다.  과연 어떤 차량인지 살펴보도록 할까요?​         익스테리어 디자인                    2023 토레스와 2024 신형 토레스EVX         먼저, KG모빌리티토레스EVX는 토레스의 전기차 버전으로써 최근 판매량이 떨어지며 경쟁력이 떨어지는 상황에서 가뭄의 단비같이 출시가 되었습니다. 제일 먼저, 눈에 띄는 부분은 LED를 사용한 도트형의 미래지향적인 LED주간주행등이 적용되었고, 하단 범퍼에 배치된 세로형의 LED헤드램프 역시 미래지향적인 느낌입니다.                    2023 토레스와 2024 토레스EVX         토레스전기차의 후면 디자인은 LED콤비네이션테일램프에 변화가 있었는데요. 토레스EVX의 테일램프는 태극기의 건곤감리에서 땅을 상징하는 '곤'을 형상화한 디자인을 적용하였고, 하단 디퓨저의 형태가 변경되었습니다. 그리고 쌍용이라는 이니셜 앰블럼 대신에 KG 모빌리티가 적용되어 출고되네요.​         실내 디자인                            전면 디자인과 더불어 실내에도 변화가 있었습니다. 2024토레스EVX에서 제일 돋보이는 부분은 바로 12.3인치클러스터(계기판)와 12.3인치 인포콘 내비게이션이 포함된 파노라마형태의 디스플레이가 적용이되었다는 점인데요. 이 부분은 최근 출시되는 차량들에서 항공기 조종석을 모티브로 설계되었는데, 토레스전기차에도 적용이 되는 부분은 인상적입니다.                      사실, 쌍용차 시절에는 최신 사양이 아니고, 기술부족의 한계로 네비가 약한 부분이 있었는데, KG에 인수 된 후에는 좀 더 최첨단 사양이 많이 들어가는 것 같아요. 요 인포콘 네비게이션시스템에는 음성인시제어 뿐만아니라 모바일원격제어, 실시간 길안내기능, 홈 LoT 일명 카투홈 기능도 있는데요. 무선업데이트기능, 안드로이드오토, 카플레이등을 사용 할 수 있고, 기존 밖에 설치되어있던 공조기를 디스플레이에서 조작이 가능하게끔 했기에 더 깔끔한 실내 디자인을 연출합니다.​         성능 및 제원 그리고 가격은?                     이번, 2024토레스EVX는 테슬라등에 들어가는 차세대 LTF(리튬인산철) 블레이드배터리가 적용되고, 이로인해 주행거리는 1회충전시 약 433km수준의 항속거리를 가지고 있으며, 73.4kWh용량에 152.2kW 즉 204마력 수준의 힘을 가지고 있으며, 34.6kg.f의 토크는 전기차 특유의 힘을 낼 수 가 있네요.                     토레스전기차의 크기 및 치수를 보면 전장 4,715mm 전폭 1,890mm 전고 1,735mm이며, 공차중량은 1,940kg으로 2톤에 못 미칩니다. 2열폴딩시에는 트렁크공간이 약 1,662L로 왠만한 중형SUV급의 수납이 가능하며, 8개의 에어백이 적용, 고장력강판으로 탄탄한 내구성을 가지고 있습니다.                     이번에는 2024년형 토레스EVX 편의사양을 살펴보겠습니다. 기본 E5트림 사양부터 스마트키시스템, 오토홀드기능이 포함된 전자식파킹브레이크, 오토디포그와애프터블로우 그리고 미세필터가 장착된 듀얼존풀 오토에어컨, 앞좌석전동 및 통풍시트, 하이패스, ECM룸미러, 무선충전, 러기지스크린, C타입충전단자, 회생제동 컨트롤 패들쉬프트, 원터치트리플 턴시그널램프가 적용되었으며 높은 트림인 E7에는 디지털키, 동승석워크인디바이스, 2열히팅시트등을 적용할 수 있습니다.                     안전사양으로는 네비게이션기반 인텔리전트 어댑티브 크루즈컨트롤, 긴급보조제동시스템, 전방추돌경고, 차선이탈경고, 차선유지보조, 부주의운전경고, 안전거리경고, 앞차출발알림, 중앙차선유지보조, 스마트하이빔, 지능형차량속도제어, 다중추돌방지시스템, 전방주차보조경고, 후방주차보조경고, 타이어공기압알림, 가상엔진 사운드가 기본 적용이고, E7 트림에서는 좀 더 기능이 많아진 긴급제동보조, 후방차량추돌경고, 후측방충돌방지경고, 후측방충돌방지보조, 후진충돌방지보조, 후진충돌방지경고, 차선변경경고, 안전하차경고, 자동차선변경 기능등을 사용 할 수가 있습니다.                     토레스전기차의 휠은 18인치와 20인치 적용이되며, 그레이 투톤인테리어와 블랙인테리어 중 선택이 가능하며, 여기서 인조 및 천연가죽 선택이 가능하니 참고하시면 되겠습니다.                      뿐만아니라 2024토레스EVX는 커스터마이징 즉 악세사리도 따로 판매가 되는데, 사이드스토리지박스, 루프크로스바, 루프플랫캐리어, 루프클라미이핸들, 멀티우산꽂이, 테일게이트LED램프, 스포츠패달, 에어매트, 차박용텐트, 아이나비블랙박스등을 추가 할 수 있으니 참고하시면 될 것 같네요. 토레스EVX가격은 E5는 5003만원이며, E7은 52224만원에 판매되지만 세제혜택을 받으면 4750, 4960만원에 판매되는데, 보조금 적용시에는 3천만원 후반대에도 구매가 가능할 수 있으니 지자체 확인을 해야겠습니다.​         마치며                     지금까지 신형 토레스전기차에 대해서 알아보았는데요. 생각보다 옵션도 풍부하고, 성능도 좋고, 가격도 매리트가있는데, 100만km 배터리보증이라는 KG모빌리티의 자신감이 돋보였습니다. 개인적으로 전기차는 아직이라는 생각을 가지고 있었는데, 점점 좋아지고 개선되는 전기차 단점이 없어지고 있는 것 같네요. 다들 행복한 하루 되세요!     ",https://blog.naver.com/hutakoi1/223217976257
상한가 2023.09.21 셀바스헬스케어 위메이드플레이 신신제약 위메이드맥스 모비스 우정바이오,상한가,태블리,2023. 9. 21. 18:37,"     종목 : 셀바스헬스케어(208370)    12870원  30.0%2023.09.21 [AI pick! 오늘의 특징주] 셀바스헬스케어https://finance.naver.com//item/news_read.naver?article_id=0000033149&office_id=037&code=208370&page=&sm=title_entity_id.basic2023.09.21 [주가동향] 셀바스헬스케어, 美 울트라사이트와 JV 설립 소식에 주가...https://finance.naver.com//item/news_read.naver?article_id=0002316340&office_id=123&code=208370&page=&sm=title_entity_id.basic                    ​​13:50:00에 최고가 12870원을 찍었습니다13:50:00에 최대 거래량 2382826거래가 터졌습니다​​종목 : 위메이드플레이(123420)    9840원  29.99%2023.09.21 “중국 진출 속도 낸다”…위메이드플레이·위메이드맥스 上https://finance.naver.com//item/news_read.naver?article_id=0005189819&office_id=009&code=123420&page=&sm=title_entity_id.basic2023.09.21 [특징주]中진출 기대…위메이드맥스·위메이드플레이 상한가https://finance.naver.com//item/news_read.naver?article_id=0005317529&office_id=277&code=123420&page=&sm=title_entity_id.basic                    ​​09:05:00에 최고가 9840원을 찍었습니다09:05:00에 최대 거래량 668579거래가 터졌습니다​​종목 : 신신제약(002800)    6460원  29.98%2023.09.21 신신제약, 차세대 마이크로니들 의약품 개발 시동…""차세대 약물전달 기술...https://finance.naver.com//item/news_read.naver?article_id=0005579957&office_id=018&code=002800&page=&sm=title_entity_id.basic2023.09.21 신신제약, 차세대 마이크로니들 의약품 개발https://finance.naver.com//item/news_read.naver?article_id=0005317569&office_id=277&code=002800&page=&sm=title_entity_id.basic                    ​​10:40:00에 최고가 6460원을 찍었습니다10:10:00에 최대 거래량 690177거래가 터졌습니다​​종목 : 위메이드맥스(101730)    10930원  29.96%2023.09.21 “중국 진출 속도 낸다”…위메이드플레이·위메이드맥스 上https://finance.naver.com//item/news_read.naver?article_id=0005189819&office_id=009&code=101730&page=&sm=title_entity_id.basic2023.09.21 [특징주]中진출 기대…위메이드맥스·위메이드플레이 상한가https://finance.naver.com//item/news_read.naver?article_id=0005317529&office_id=277&code=101730&page=&sm=title_entity_id.basic                    ​​09:00:00에 최고가 10930원을 찍었습니다09:00:00에 최대 거래량 443971거래가 터졌습니다​​종목 : 모비스(250060)    5910원  29.89%2023.09.21 거래소, 모비스에 시황변동 관련 조회공시 요구https://finance.naver.com//item/news_read.naver?article_id=0005580719&office_id=018&code=250060&page=&sm=title_entity_id.basic2023.08.16 모비스, 현저한 시황변동 조회공시 요구받아https://finance.naver.com//item/news_read.naver?article_id=0005552525&office_id=018&code=250060&page=&sm=title_entity_id.basic                    ​​09:55:00에 최고가 5910원을 찍었습니다09:00:00에 최대 거래량 6627635거래가 터졌습니다​​종목 : 우정바이오(215380)    3175원  29.86%2023.06.08 한국투자파트너스 “우정바이오 지분 9.59% 보유”https://finance.naver.com//item/news_read.naver?article_id=0005503435&office_id=018&code=215380&page=&sm=title_entity_id.basic2023.05.26 우정바이오, 50억 규모 전환사채 발행 결정https://finance.naver.com//item/news_read.naver?article_id=0005494489&office_id=018&code=215380&page=&sm=title_entity_id.basic                    ​​11:30:00에 최고가 3175원을 찍었습니다11:30:00에 최대 거래량 1132691거래가 터졌습니다​​​     ",https://blog.naver.com/th9019/223217976209
오랜만에 테슬라 모델y 손세차 시키기. 맥스워시 라운지.,[블챌] 체크인 챌린지,구니,2023. 9. 21. 18:33,     이번 여름에 너무 덥다는 핑계로 세차를 안해서 차가 매우 꼬질꼬질했어요.​그나마 비오는날 운행 할 때폭우가 쏟아지는 날이 많아서자연세차를 좀 해서 그렇지차량 문짝에 손글씨를 쓰면멀리서도 보일 정도였어요.​                    ​오늘 날도 시원하고 맑아서큰 맘 먹고 대략 3개월 만에손세차를 한것 같아요.​                    ​오랜만에 2시간 정도 손세차를 했는데미트질 하면서 보니도장면이 정말 많이 더러웠고고압수 뿌리고 물기제거하면서 보니타르도 상당히 많이 묻었네요.​문짝에 뭔지 모를 누런 얼룩이 생겨서지워지지 않는데일단 신경은 쓰이지만2시간이 넘는 세차에 팔이 아파서나중에 다시 보기로 했어요.​                    ​​             맥스워시라운지 인천광역시 계양구 아나지로 60           ​동네에서 가깝고실내라서 겨울에도 세차가 가능해서 정착한맥스워시 라운지는평일 낮시간에도 사람이 제법 많으니 참고하세요.     ,https://blog.naver.com/xorbsldi/223217972672
노조 파업에 시기에 더 빛나는 테슬라,미국 주식 투자 (TSLA),Hi TEL,2023. 9. 21. 18:31,"     테슬라에게는 3가지가 없다.딜러, 광고가 없고, 그리고 노조가 없다.​내연기관 자동차의 종말이 다가오고 있고, 이제는 미국의 자동차 Big 3사, GM, Ford, Chrysler  파업이 초 읽기에 들어 갔다.​임금을 올려줘도 망하고, 회피해도 망하게 생겼다.물론 그 전에 GM과의 합작사 한국 배터리사(Ultium Cells)들은 노조 임금을 모두 올려서 UAW 대상이 아니다.​테슬라는 노조가 없기 때문에 더 빛나고 있다.​게다가 전 세계 유일무이한 최고의 공장을 가지고 있는 테슬라는 인간의 노동을 뛰어넘어 테슬라봇(옵티머스)을 활용한 공장 자동화를 만들어가고 있다.​이미 그들과의 격차를 생각할 때, 게임은 끝났다.​스토리가 있는 기업, 테슬라의 질주에 주식 투자자들이나 차 소유주들은 늘 즐겁다.     ",https://blog.naver.com/gohitel/223217971230
[주식] 오늘의 상한가종목 보고서 2023-09-21 셀바스헬스케어 & 위메이드플레이 & 신신제약 & 위메이드맥스 & 모비스 & 우정바이오,주식이야기,머블리,2023. 9. 21. 18:31,"                   보고서(클릭)  종가  상승률(%)  기관순매매량  외국인순매매량  60일mdd(%)  60일평균  60일평균괴리율(%)  rsi21  rsi21전일차이  종목Link  0  셀바스헬스케어  12870  30  +3,096  -147,106  0  8310  35.43  69.46  12.36  셀바스헬스케어  1  위메이드플레이  9840  29.99  -10,155  -33,228  -4.47  8648  12.11  63.11  24.87  위메이드플레이  2  신신제약  6460  29.98  +48,464  -120,597  0  4823  25.34  77.32  25.65  신신제약  3  위메이드맥스  10930  29.96  -13,650  +1,102  -3.62  9452  13.52  62.86  21.78  위메이드맥스  4  모비스  5910  29.89  +50,000  -277,824  0  2812  52.42  71.63  6.92  모비스  5  우정바이오  3175  29.86  +29,884  -12,445  0  2646  16.66  69.09  27.18  우정바이오            ​     ",https://blog.naver.com/dedear1/223217971037
미국(2023.09) FOMC 금리 동결에 대한 생각,경제/사회에 대한 나의 생각,Juno,2023. 9. 21. 18:30,"      미국 중앙은행 기준금리는 5.5%로 고정 결정                             한국은행이 제롬 파월 미국 중앙은행(Fed) 정례 회의 후 기자회견에서 ""고금리 장기화 가능성을 암시했다""라고 분석했다. ​한은 뉴욕 사무소는 1. 9월 FOMC 회의 결과에 대한 시장 참가자들의 평가 및 금융시장 반응 2. 보고서를 통해 경제전망에서 내년 중 금리 전망이 예상보다 크게 상향 조정되고, 기자회견에서 정책금리 인하 전화에 신중하겠다는 입장을 밝힘3. 따라서 고금리 장기화 가능성을 암시한 점 등을 보아 매파적으로 해석4. 정책결정문에서는 경제활동 속도에 대한 표현을 강화함으로써, 성장세 호조를 강조, 고용도 견조한 상황이 유지되고 있다고 제시5. 한편 추가 인상 여지가 담긴 표현을 유지(the extent of additional policy firming)6. 경제전망에서는 최근의 경제지표 호조를 반영하여 금년 및 내년 국내총생산(GDP) 성장률을 상향, 실업률을 하향 조정7. 점 도표에서는 금년 최종 금리 전망을 유지했으나, 내년 전망을 예상보다 50bp 상향 조정 *파란색: 비둘기, 빨간색: 매파 섞어서 의미를 전달함​그리고 마지막으로 파월 의장 기자회견에서          물가 및 경제 상승을 볼 때 금리가 아직은 충분히 제약적인 영역에 도달했다고 확신하기에는 이르며 당분간 현재의 기조를 유지할 필요가 있다. 제롬 파월         또한         정책금리 인하 전환에도 신중하겠다 제롬 파월         ​여기서 생각을 분석해 볼 필요가 있을 것 같다. 일단은 데이터를 먼저 살펴보자​         데이터상 경제는 더 좋고, 인플레는 낮아진다                    1. 시장의 전체 CPI 감소와 코어 CPI의 감소되고 있으며, 주택 가격은 감소는 1년 정도 후행지표로 반영이 되기 때문에    계속해서 CPI는 떨어질 것으로 예상됨2. 여기서 변수는 원유의 가격 증가로 인해 소비재의 물가가 상승하는 것으로 보이나 그것도 일시적으로 보고 있음  (혹시 지속해서 $90후반대나 $100을 뚫게 된다면, 장기간 이어지게 되면 이야기는 달라지지만,    미국을 제외하고는 아직 경제가 활성화되지 않고, 생산량 감소로 유가를 상승시키기에는 한계가 있을 것으로 보임)3. 즉, 길게 보면 CPI가 하락할 것은 분명함​                    1. 실업률 지표도 보게 되면 코로나 이후 점차 하락하여, 현재는 안정적인 추세이며, 산업이 전환되는 시기임2. 또한 바이든 정책상 제조공장을 미국에 건설함에 따라, 현재는 건설노동자들이 많이 필요한 사항으로 건물이 완성되는 기간(보통 2년) 동안은     실업률은 안정적인 모습을 보일 것으로 판단됨​         실질적으로 이러한 데이터가 나오면 금리 인상을멈추고 인하하는 방향으로 전환하는 것이 맞음         왜 제롬 파월은 매파적인 발언을 한 것일까?          여기서부터는 저의 생각입니다.  ​연준은 인플레이션을 가볍게 보다가 2022년 10월 금리 인상으로 막을 수 있었던 인플레이션을 자신의 오판으로 더 크게 키운 점2008년 리먼브라더스 사퇴 이후로 처음 발생되는 인플레이션임폴 볼커 때 인플레이션이 안정되는 줄 알고 금리를 내렸다가 더 크게 쇼크가 난 적이 있음                    여기서 1980년대를 보게 되면, 금리를 20%로 올렸다가, 미 정부(레이건 대통령)의 압박에 금리를 급격하게 인하를 했었다다시 인플레이션이 폭발하는 바람에 금리는 더욱 높게 장기간 동안 유지한 적이 있다. ​그래서 제롬 파월은 신중할 수밖에 없을 것으로 판단됨.따라서 파월의 말들을 보게 되면          1) 2024년에 금리 인하를 할 수도 있지만 안 할 거야( Powell, going into 2024, ""the time will come at some point, and I'm not saying when"")2) 사람들은 인플레이션을 싫어해( ""People hate inflation. Hate it."")3) 연착륙이 가능하다고 생각하지만 신중해야 해( ""Do Think Soft Landing Is Possible, Must Move Carefully"")4) 제약적인 금리는 봐야 할 것 같아   ( ""You know 'sufficiently restrictive only when you see it"",""with confidence."") FOMC 제롬 파월         ​​         즉 금리 인상을 하겠다는 의미보단, 아직 너희들에게 금리 동결 및 인하에 대한 기대감을 주지 않겠다         라고 저는 생각이 됩니다. ​괜한 기대감으로 현재까지 멈춰있던 주식에 대한 대기 자금들이 폭발하게 된다면, 또다시 다른 형태의 인플레이션을 만들 가능성이 높기 때문이죠. 그래서 언제가 될지는 모르지만, 인상은 하지 않을 것 같고 5.5%의 금리를 길게 가져갈 것 같습니다.그리고 사람들의 기대감이 거의 줄어들 그때가 되면 인하에 대한 이야기가 나오지 않을까요? ​​#연준 #FOMC #금리결과 #테슬라 #아이온큐 #금리동결 #미국경제 #FOMC9월 #2023FOMC #폴볼커 #제롬파월     ",https://blog.naver.com/heojh90/223217949804
