마감시황과 매매일지 2023.09.21,마감시황 매매기록,학습인,2023. 9. 21. 21:32,"     ""초보"" ""주린이"" 이런 표현을 쓰지 않습니다. 투자결정에 대한 책임감을 강화하기 위해서입니다저는 가치투자자가 아닙니다. 시장을 추종하고 분산투자를 하고 배당을 좋아 할 뿐입니다​1)구체적인 매매기록은 남기지 않고자 합니다. 제가 하는 거 보셔도 도움이 안되실겁니다. 지주사, 배당주, 금융주, 통신주 위주로 합니다. 연간 목표수익률은 4% 정도 됩니다​2)매수 : ​미국채 3개월 : 목표수익률 4% 이상미국채 7개월 : 목표수익률 4% 이상미국채 14개월 : 목표수익률 4% 이상​​맥쿼리인프라 : 매수목표가 770(연간 예상 배당금) / 6%(목표 시가배당률) = 12,833 보다 낮은 가격삼성FN리츠 : 분기배당하는 삼성브랜드의 리츠​​VIP한국형 가치투자증권자투자신탁 : 저보다 훨씬 더 운용 잘합니다​SJM홀딩스 : 내연기관차 부품을 제조하는 SJM의 지주회사. 현금성자산 > 시가총액현대지에프홀딩스 : 고배당을 약속한 현대백화점그룹 지주회사코엔텍 : 실적이 천연가스 가격과 연동되는 폐기물 처리주국보디자인 : 주가가 실적보다는 테슬라 주가에 연동되는 희한한 회사. 배당성장중현대이지웰 : 범현대그룹의 선택적 복지를 담당. 배당성장중BGF리테일 : 날씨 때문에 주가가 박살나고 있는 듯 한데 용기내어 추가매수​NIKKO EXCHANGE TRADED INDEX FUND TOPIX (TOKYO 1308) : 엔화 가치회복은 언젠간 온다ISHARES JAPAN REIT ETF (TOKYO 1476) : 엔화 가치회복은 언젠간 온다​3)매도 : ​SK텔레콤 : 현금비중 확보 위해 5만원 이상에선 매도 (48,000 이하에선 매수)GS : 현금비중 확보 위해 4만원 이상에선 매도 (38,000 이하에선 매수)CJ4우(전환) : 고금리 시대엔 재무구조 좋은 기업이 잘 버틴다. 전량 매도제일기획 : 현금비중 확보 위해 2만원 이상에선 매도 (19,000 이하에선 매수)삼성물산 : 지주회사이지만 배당이 미흡. 건설업도 쉽지 않아 보임. 전량 매도​4)현금비중 감소, 주식비중 감소, 채권비중 증가, KRX 금현물 없음한국채권 비중 증가, 미국채권 비중 증가KRW 현금비중 증가, USD 현금비중 감소소액환전 (USD → KRW)소액환전 (KRW → JPY)​5)자사주체결            종목명  신청수량  당일체결수량  체결율(%)  CS홀딩스  200  200  100  KB금융  50,000  50,000  100  KH바텍  10,000  10,000  100  KT&G  100,000  100,000  100  LG  20,000  20,000  100  NICE  6,000  6,000  100  SK디스커버리  3,000  3,000  100  SK스퀘어  50,000  50,000  100  그린생명과학  10,000  10,000  100  네오위즈홀딩스  10,000  10,000  100  다스코  15,000  15,000  100  대림제지  2,000  2,000  100  대웅  15,000  15,000  100  동아지질  5,000  5,000  100  동양피스톤  10,000  10,000  100  동일제강  5,000  5,000  100  디에스케이  10,000  10,000  100  린드먼아시아  10,000  10,000  100  메리츠금융지주  51,000  51,000  100  미원상사  2,000  2,000  100  삼성공조  2,000  2,000  100  서희건설  300,000  300,000  100  수젠텍  50,000  50,000  100  시큐브  30,000  30,000  100  신대양제지  100,000  100,000  100  신성델타테크  200,000  200,000  100  아가방컴퍼니  25,000  25,000  100  아세아제지  3,000  3,000  100  에스코넥  70,000  70,000  100  에이원알폼  30,000  30,000  100  원티드랩  10,000  10,000  100  이건산업  10,000  10,000  100  이노룰스  2,000  2,000  100  이씨에스  15,000  15,000  100  인지소프트  400  400  100  케이프  20,000  20,000  100  팜스빌  1,000  1,000  100  푸드나무  4,000  4,000  100  플래티어  1,000  1,000  100  하이비젼시스템  30,000  30,000  100  한국수출포장  5,000  5,000  100  헥토이노베이션  5,000  5,000  100  현대엘리베이  30,000  30,000  100  화일약품  200,000  200,000  100  지란지교시큐리티  10,000  9,949  99.49  아세아시멘트  10,000  9,755  97.55  엘비인베스트먼트  5,000  4,800  96  오성첨단소재  200,000  180,188  90.09  웨이브일렉트로  30,000  25,971  86.57  매커스  15,000  12,000  80  종근당홀딩스  2,000  1,425  71.25  오로라  5,000  3,545  70.9  디씨엠  10,000  6,760  67.6  클래시스  70,000  47,244  67.49  SK텔레콤  60,000  40,000  66.67  아이에이  300,000  193,967  64.66  대교우B  3,000  1,898  63.27  아세아  200  125  62.5  에스에프에이  30,000  18,500  61.67  피에이치에이  20,000  12,000  60  쌍용C&E  100,000  55,500  55.5  한국정보통신  10,000  5,000  50  한국토지신탁  200,000  90,763  45.38  미원에스씨  1,800  637  35.39  대교  15,000  4,257  28.38  원풍  20,000  5,000  25  현대모비스  50,000  12,000  24  대동전자  80,000  4,868  6.08  세아홀딩스  200  0  0            ​6)공매도과열종목 : ​                    7)공매도 거래 상위 종목​                               8)공매도 잔고 상위 종목 : 2거래일전 데이터가 최신입니다                                9)코스피 PBR PER 배당수익률 코스피200 PBR PER 배당수익률                     10)신용잔고 예탁금 미수금 미수금대비반대매매비중신용잔고 , 예탁금 모두 소폭 증가                    코스닥 신용잔고 감소 코스피  신용잔고 증가미수금과 반대매매 비중 모두 높은 수준 유지​                               ​11)시장지표환율 급등 유가 하락 금시세 상승?                    외국인은 현물 순매도 선물 폭풍매도 (1.2조)개인은 현물과 선물 모두 강매수 기관은 현물 강매도 선물 강매수                                          12)52주 신고가세아제강지주 벽산 DI동일 코리안리 기업은행 삼성화재 진양산업 신신제약 모비스 비츠로테크 씨씨에스 글로벌텍스프리 파버나인​​13)52주 신저가롯데에너지머티리얼즈 PI첨단소재 LG화학 엔씨소프트 화인베스틸 조선내화 대성홀딩스 두산퓨얼셀 팜스코 한화솔루션 씨에스윈드 SG세계물산 신라교역 HD현대에너지솔루션 카카오 BGF리테일 대성산업 동양철관 사조씨푸드 크래프톤 삼성출판사 아주스틸 KEC 진원생명과학 코오롱모빌리티그룹 한솔홈데코 테이팩스 국동 시디즈 키다리스튜디오 대한방직 동원산업 한솔홀딩스 동서 대유에이텍 롯데리츠 LX홀딩스 한국토지신탁 한창제지 콘텐트리중앙 휴니드 파멥신 셀리드 네오위즈 코어라인소프트 대유에이피 위니아 크라우드웍스 스튜디오미르 이원컴포텍 에프알텍 네오이뮨텍 바이젠셀 천보 엠투엔 대보마그네틱 와이씨켐 한일단조 스코넥 아이컴포넌트 에코캡 유일에너테크 산돌 키네마스터 네온테크 디케이티 래몽래인 유틸렉스 위지윅스튜디오 씨케이에이치 엔브이에이치코리아 화인써키트 SM C&C 나노팀 누리플랜 뉴인텍 넥스턴바이오 제주맥주 베셀 CNT85 엘디티 LB세미콘 아이에이 오킨스전자 골드앤에스 상아프론테크 아미코젠 NHN벅스 티케이케미칼 아모텍 헬릭스미스 제넨바이오 알피바이오 옴니시스템 파인테크닉스 에이치와이티씨 아미노로직스 카나리아바이오 오브젠 대성하이텍 한국정밀기계 소니드 카카오게임즈 시지트로닉스 NHN KCP 바이넥스 동국S&C 진매트릭스 쿠콘 컴투스 포바이포 인선이엔티 범한퓨얼셀 삼영에스엔씨 강스템바이오텍 컴투스홀딩스 핀텔 서한 스페코 플라즈맵 커머스마이너 와이엠티 씨큐브 SDN 인콘 대주산업 맥스트 DH오토웨어 고려시멘트 트윔 SBI인베스트먼트 탑코미디어 텔콘RF제약 CJ프레시웨이 세종메디칼 씨유테크 한일진공 팜스빌 이엠넷 씨유메디칼 솔고바이오 판타지오 에스에너지 골든센츄리 한국맥널티 룽투코리아 에스앤디 인베니아 그린플러스 스타플렉스 오로라 대호특수강 DGP 위니아에이드 세원물산 아이큐어 삼진엘앤디 싸이토젠​14)정리시장대비 선방했습니다만 환율 덕분입니다신용매수를 터뜨려 보려는 시도가 있는게 아닌가 추측이 됩니다. 반대매매가 조만간 크게 나오는지 봐야겠습니다BGF리테일과 동원산업 주가하락으로 마음이 무겁습니다채권비중이 높아지니 주식시장이 더 잘 보이는 것 같다는 망상을 하기 시작했습니다. 숏충이 아닙니다다른 곳에 정신이 팔려 있었습니다. 제 목표 수익률(4%)보다 높은 금리(5%)가 내년에도 유지된다면 열심히 주식투자할 필요가 없다는 생각도 드네요                    ​15)표는 생략합니다. 재미도 없고 창피하기도 하고 그렇습니다​16)미국지수선물 생략합니다. 1시간 후면 시장이 열립니다. 분위기 겁나게 안좋네요​17)국내 주식 히트맵 출처는 아래와 같습니다              줌 투자 한눈에 보는 국내 해외 증시 지수 정보와 전문가의 투자 인사이트를 줌 투자에서 확인하세요 invest.zum.com              코스피 마켓맵 | 한경코리아마켓 | 한국경제 변동률 1일 1주 1개월 3개월 6개월 1년 박스 크기는 시가총액이며, %는 변동률입니다. 변동률 -3% -2% -1% 0% 1% 2% 3% ※ 종목을 더블 터치하면 종목 페이지로 이동합니다. 2023.05.22 장마감 코리아마켓 금융 정보는 각 콘텐츠 제공업체로부터 받는 투자 참고사항이며, 오류가 발생하거나 지연될 수 있습니다. 한경닷컴과 콘텐츠 제공업체는 제공된 정보에 의한 투자 결과에 법적인 책임을 지지 않습니다. 게시된 정보는 무단으로 배포 할 수 없습니다. 기업·재무정보는 NICE 평가정보에서 제공받는 데이터로 기준일, 세... markets.hankyung.com                                  18)아래 사이트에서 배당 정보 조회 가능하네요. 배당금은 주로 목,금요일에 집중되는군요           SEIBro  seibro.or.kr            ​19)각종 경제 금융 지표를 편리하게 볼 수 있는 곳입니다           한국은행 금융경제 스냅샷 한국은행 금융 · 경제 스냅샷 검색 주요 검색어 # 금리 # 물가 # 환율 # GDP # 유동성 즐겨찾기 즐겨찾기 기능을 이용하여 편리하게 사용하실 수 있습니다. 국내 금융시장 외환시장 실물경제 지역경제 국제 금융시장 세계경제 100대 지표 세계 속의 한국경제 snapshot.bok.or.kr            ​​     ",https://blog.naver.com/kwangpoong/223218102551
테슬라 슈퍼차저 매직독 설치에 따른 요금제 변경,테슬라,도다닥,2023. 9. 21. 21:30,"     #현재 테슬라는 국내에서 슈퍼차저에 매직독을 설치하고 있다. 간단히 말하면 테슬라뿐만 아니라 타제조사의 전기차도 충전을 할 수 있게 만든 것이다. ​최근에 고양시 도내동, 광명시 AK, 광명역사, 금천 마리오아울렛, 용산 드래곤시티, 영종 그랜드하야트, 부천 롯데백화점.. 많은 슈차에서 수리 중이거나 수리를 완료했다. ​​#가장 큰 변화는 기존 분당 요금제에서 Kw 당 요금으로 변경되고 있다. 카페에서 확인한 바 전부 매직독방식(분당요금제-> 사용량에 따른 Kw요금제)로 변경될 예정.​해당 방식을 적용하면 슈차에서 완충 시 2만원 후반이 나올 예정. 이러면 슈차 이용이 현저히 줄어들 텐데. ​​# 아마도 앞으로는 여행 시 급히 사용하는 용도로 바뀔 예정이며, 많은 사람들은 오히려 DC 콤보를 이용해서 많이 사용할 것 같다. 여행 갈 때 빼고는 집밥을 하겠지만. ​그래도 차량에서 슈차를 자동으로 안내를 해주기 때문에 편의성에선 좋겠지만 결국엔 내 돈이 많이 나가면 그만큼 덜 쓰겠지. ​​# 아직도 RWD 14일 신청자를 다 처리를 못하고 있다. 상하이 공장에서 매일매일 차를 받아왔으면 좋겠다. 전기차 보조금이 소진된 지역이 많이 나오고 있다. 추경호 경제부총리는 전기차 보조금 지원을 확대한다고 하지만. 국내 업체에 몰아줄 것이라는 전망도 있다. ​보조금이 핵심 관건이다. 하루빨리 차를 받고 싶다. 올해에 꼭 받을 수 있기를.      ",https://blog.naver.com/ks_in_dw/223218101379
"[K-Topic] 8년간 신장 이식·암 이겨내고 ‘세번째 축복’ 낳았다 외 45건 - September 21, 2023 (3)",한국외신뉴스(속보),디스클로저,2023. 9. 21. 21:25,"     8년간 신장 이식·암 이겨내고 ‘세번째 축복’ 낳았다 조선일보춘천 7남매 가족 “감자빵 주문 10배 늘었어요” 조선일보잘 때 다리 경련, 한 쪽만 부을 때… ‘만성 정맥 부전’ 의심 조선일보“나도 앓았습니다” 하지정맥류 名醫의 치료법 조선일보尹, 16분 유엔연설... 메모한 中, 복지부동 러, 안보인 北 조선일보유엔 연단에 선 尹 ""북·러 군사거래는 한국 직접 겨냥한 도발"" | 중앙일보 중앙일보'디지털' 15번 외친 尹…지난해 강조했던 '자유'는 줄었다 | 중앙일보 중앙일보""먼 바다 가도 오징어 없어요""…열병 걸린 동해가 비어간다 [창간기획-붉은 바다] | 중앙일보1.6조 쏟은 바다숲 인공어초…흉물스러운 콘크리트 무덤 됐다 [창간기획-붉은 바다] | 중앙일보열 나르는 대서양 '해류 컨베이어 벨트' 고장?…지구적 위기 오나 [창간기획-붉은 바다] | 중앙일보이재명 ‘부결’ 지침, 일부엔 역효과…누구도 장담은 못 한다 한겨례[현장] 일본 군함도 홍보관, ‘조선인 차별 없었다’ 왜곡 추가 한겨례미 연준, 기준금리 동결…연내 추가 인상·내년에도 고금리 예고 한겨례[단독] 영진위 창작·제작 예산 ‘싹둑’…독립영화부터 직격탄 한겨례[단독] 직제에서 ‘평화’ 없앤 통일부, 법령에서도 ‘평화 지우기’ 한겨례“부결입니다” ‘인증’한 민주당 의원 100명 넘었다 국민일보진중권 “이재명 ‘부결 요청’ 빵터져…구속될 거 아는것” 국민일보[단독] 어디가 보험금 제대로 안 주나…부당 부지급 1위 현대해상·삼성생명 국민일보집값 반등에… 서울 6억 이하 아파트 거래 25.6% 사상 최저 국민일보美연준 “연내 추가 긴축, 내년에도 고금리 유지” 국민일보이재명 체포안·한덕수 해임안..오늘 국회서 표결 이데일리[단독]육아휴직 지원 4000억 늘린다더니…실업급여 끌어쓰고 '생색' 이데일리사그라진 초전도체株 마지막 불꽃…'믿음' 못 버리는 개미 이데일리“60만원 입금받고 잠적”…임영웅 콘서트 사기 피해 속출 이데일리“꽁초 넣은 소변 마셔라”…여중생들이 남학생에 한 짓 이데일리美, 금리 동결했지만…파월 강펀치에 주식·채권 '녹다운' [Fed 워치] 한국경제""추가 인상 준비""…긴축 경계감에 나스닥 1.5% 급락 [뉴욕증시 브리핑] 한국경제""검찰 멈춰 세워달라""…이재명 '운명의 날' 밝았다 한국경제""큰 손 잡아 보릿고개 넘자""…'기업 손님' 찾아나선 B2C 플랫폼 [긱스] 한국경제'Higher for Longer'…잭슨홀보다 무서워진 파월 [김현석의 월스트리트나우] 한국경제파월 美연준 의장 ""연착륙 기대감 커져..내년 금리도 5% 유지"" - 머니투데이 머니투데이'20억' 흥행, 다음은 46억?…부산 분양가 천장 뚫는다 - 머니투데이 머니투데이""50년 '염전 노예' 탈출 67세에…신안군은 세금 독촉"" - 머니투데이 머니투데이[영상] ""어~ 왔어?"" 드러누워 인사까지…中 반달곰에 ""사람 아냐?"" 의혹 - 머니투데이 머니투데이나무 쓰러지고 주택 잠겨…'가을장마'에 경북 밤새 비 피해 - 머니투데이 머니투데이칩스법 1년...中숨통 죄는 美 vs 자원·애플 규제 반격 나선 中 파이낸셜뉴스미국 통화긴축, 예상보다 길어진다…한국 경제에 '부담' 파이낸셜뉴스[뉴욕증시] 파월 강성 발언에 나스닥 1.53%↓ ...애플 2% 급락 글로벌이코노믹달러 강세, 뉴욕증시 대형 악재로 부상 우려 글로벌이코노믹美 경제핵심 소비 비관 전망 확산...주식시장에 '먹구름' 글로벌이코노믹테슬라, UAW 전면 파업 땐 상당한 반사이익 글로벌이코노믹한국항공우주, 해외 수주로 실적 개선돼 밸류에이션 재평가될 듯 글로벌이코노믹윤 대통령 ""러북 군사거래, 대한민국 안보 겨냥한 도발…좌시 않을 것"" JTBC뉴스'3000억' 훔쳐도 은행은 몰랐다…금융계 '역대 최대' 횡령사고 JTBC뉴스파월 연준의장 ""2% 물가 멀어"" 추가금리인상 시사…다우지수 0.2% 하락 JTBC뉴스'마약 상습 투약 혐의' 유아인, 오늘 두 번째 영장실질심사 JTBC뉴스              [K-Topic] 8년간 신장 이식·암 이겨내고 ‘세번째 축복’ 낳았다 외 45건 - September 21, 2023 8년간 신장 이식·암 이겨내고 ‘세번째 축복’ 낳았다 춘천 7남매 가족 “감자빵 주문 10배 늘었어요” 잘 때 다리 경련, 한 쪽만 부을 때… ‘만성 정맥 부전’ 의심 “나도 앓았습니다” 하지... www.k-news.co.kr            아래 주소로 접속하십시오. 더 많은 내용과 번역을 통해 가장 빠른 뉴스를 체험하실 수 있습니다.​           한국외신뉴스 190개국 40개 언어, 데이터 저널 MCN k-news.co.kr                 뉴스8 우리지역 뉴스와 정보를 한 곳에서 news8.co.kr                 디스클로저 : 네이버 프리미엄콘텐츠 웹 조사기관 W3Techs에 의하면 인터넷의 59.9%는 영어, 한국어는 0.6%를 차지한다고 합니다. 99.4%의 정보는 한국어가 아닌 다른 언어로 쓰여져 있다고 합니다. 즉 외신은 한국 뉴스의 200배가 넘는 정보의 보물창고라 할 수 있습니다. <디스클로저> 추적 외신이슈는 하루에도 수천만 건씩 발생하는 해외 뉴스를 지능형으로 빅데이터 분석합니다. 이후 전문 큐레이터가 관심 이슈와 어젠다를 분류하여 추천하면 독자는 이를 직접 해석하거나 모르는 외국어는 브라우저 등의 자동번역 기능을 이용하여 언어 제약 없이 볼 수 있는 국내/세계... contents.premium.naver.com              밥짓다 : 네이버쇼핑 스마트스토어 마법의 'DIET' 즉석밥, 저항성전분 혈당억제 착한밥 smartstore.naver.com            ​​책임의 한계와 법적 고지디스클로저(disclosure)는 세계뉴스 빅데이터분석시스템으로 이미 생산된 뉴스를 '있는 그대로'를 소개합니다. 즉, 언론사의 뉴스는 언론사가 독립적으로 작성 또는 제작한 정보이기 때문에 디스클로저에서 그 정보의 정확성, 신뢰성 또는 적법성은 원칙적으로 해당 정보를 작성하였거나 혹은 제작한 당사자가 담보하고 이에 따른 책임을 부담합니다.     ",https://blog.naver.com/disclosurekorea/223218097411
테슬라와 중국,[TESLA] 테슬라 이야기,longd,2023. 9. 21. 21:24,"     1. 중국은 '비즈니스 장벽'이 높은 나라​자국 기업 육성 위주의 정책과 까다로운 규제로 중국은 외국기업이 비즈니스 하기 힘든 나라.테슬라도 2014년 처음 중국으로 진출하고 어려움을 겪음(중국정부는 보조금 정책을 수입차에 적용하지 않음, 미국 기가팩토리에서 만들어 가지고 오는 자동차에는 관세가 붙음, 물류 비용까지) → 이에 테슬라는 현지 생산 전략을 세우고, 상하이 기가 팩토리를 건설.                    2. 중국은 테슬라에 파격적 혜택 제공 ① 2018년 미중 무역갈등 시작 ② 그해 5월 일론머스크 중국 방문 고위 관료들과 베이징 회동  ③ 리커창 총리 '테슬라가 중국 개방에 깊이 참여하고 중미 관계 안정을 촉진하는 역활을 할 수 있기를 바란다' 환대     (머스크는 영주권까지 제안 받을 정도였다고 함, 당시 미중 긴장관계속에 관계회복에 단초 역활을 한셈) ④ 베이징 회담후 상하이 기가 팩토리 가속도 붙음, 법인세 25→15%만 부과하는 혜택 제공, 기록적인 속도로 1년만에 착공 완료.                    3. 중국은 왜 테슬라에게 혜택을 줬나?  자국 자동차 산업을 육성하기 위한 수단으로 테슬라를 활용한 것. 애플이 중국을 아이폰 생산기지로 삼으며 중국 부품 공급업체들의 생태계가 구축되었었음. 이를 테슬라에도 대입한 것. 이는 적중. 테슬라의 성장과 같이 중국 신에너지차 시장도 폭발적 성장. 2018년 테슬라 중국매출 2조3476억원▶22년 24조2484억원으로 5년만에 932%성장함. 더불어 중국 자동차 부품업계의 공급망도 탄탄해짐. 상하이 팩토리의 중국부품이 95%. 더불어 중국의 신에너지 자동차 브랜드도 크게 성장함. 중국 신에너지 자동차 시장내 81%가 자국 브랜드(BYD, 지리, 창안), BYD는 세계 최대의 전기차 제조업체로 등극.             BYD        ​4. 테슬라로 인한 중국 지역경제 활성화  니청(상하이 남동쪽 외딴마을)의 드라마틱한 변화  레드머트시티에서▶테슬라 타운으로 진화 ""하나의 산업이 흥하자, 모든 사업이 흥하다.""​​​     ",https://blog.naver.com/longddd/223218096718
"테슬라 모델 Y 화이트 핸들 도색 커스텀 , 컬러안전벨트",도색커스텀,스페셜커스텀,2023. 9. 21. 21:24,"                안녕하세요,​카테리어 전문 튜닝 스페셜커스텀 입니다.                  테슬라 모델 Y/핸들 에어백 도색 커스텀컬러안전벨트                             테슬라 신형 모델 Y 차량입니다많은 분들이 핸들 튜닝하면~  '요크핸들'을 가장먼저 떠올리실텐데요,                    기본적으로 블랙 색상으로 출고되는 원형 핸들에서색상만 화이트컬러로 커스텀을 해도완벽한 카테리어 효과를 누리실 수 있습니다!                    가죽 전용 안료를 이용해서도색을 진행한 모습입니다!​순정 그대로의 질감과 촉감을 90프로 이상유지한 작업 결과물입니다.                    실내 화이트 블랙의 이미지와의 조화가아주 적절하네요:)                    컬러안전벨트 '스카이블루' 컬러운전석과 조수석, 후석까지 총 5좌석시공된 모습입니다.                    안전성 검사 모두 통과된 국산 제품의 웨빙 사용과작업자인 본인이 직접 공업용 미싱 작업으로안전하게 시공드리고 있습니다~                           실내 분위기가 엄청 밝아졌습니다~예쁘죠?                               같은 차,다른 느낌~                    차량 밖에서도 톡톡 튀는 실내 모습이 눈에 띕니다!차량 인테리어 변화는 주행 중,운전자의 기분이나 컨디션에도 굉장히 많은영향을 끼치는 것 다들 아시죠?                    ​국산, 수입 전차종 가능합니다!​감사합니다.                  ​예약제 시공문의주세요​주소 : 인천광역시 서구 가정동 612-4, 1층TEL : 032-561-1634Phone : 010-7522-1634영업일 : 월요일~토요일 (일요일 휴무)​​​     ",https://blog.naver.com/specialcustom/223218096248
기다린 자에게 복이 오나니,투자 일지,Betterlife,2023. 9. 21. 21:24,"     * SAMG엔터* 넥스틸​보답해 줄 때가 오는 것인가.이번에는 목표가까지 기다려보자.​​written by HWEE​​※ 개인적인 투자 일지이며, 종목 추천 아닙니다. ​​#SK이노베이션 #이아이디 #엘앤케이바이오 #에이블씨앤씨 #현우산업 #조광ILI #앤디포스 #국도화확 #KH필룩스 #이아이디 #롯데지주 #성일하이텍 #대동 #이화공영 #롯데지주 #아남전자 #유니드 #아난티 #팜스코 #랩지노믹스 #동양피스톤 #케이옥션 #에스와이 #에코마케팅 #오하임아이엔티 #큐라클 #에코프로에이치엔 #오픈엣지테크놀로지 #크리스탈신소재 #네이처셀 #아이큐어 #아프리카TV #에이피티씨 #빅솔론 #케이옥션 #제이아이테크 #메리츠금융지주 #NI스틸 #에스코넥 #HB테크놀러지 #나녹스 #나노엑스이미징 #팔란티어 #아이온큐 #테슬라 #빔테라퓨릭스 #비욘드미트 #나이키 #파두 #현대글로비스 #넥스틸 #시노펙스 #환인제약 #공구우먼 #자이글 #올릭스​​​     ",https://blog.naver.com/hweeseul8186/223218096492
